{
 "book": "gifted-amateur",
 "unit_id": "ch22",
 "title": "Motion in the Schwarzschild geometry",
 "part": "IV: Orbits, stars, and black holes",
 "printed_pages": [
  237,
  245
 ],
 "pdf_pages": [
  254,
  262
 ],
 "one_line_summary": "Shows that free motion outside a spherical mass can be analysed without ever writing the geodesic equation: read two conserved quantities (energy and angular momentum per unit rest mass) off the metric's missing coordinates, combine them with the normalization of the four-velocity, and derive the gravitational redshift, a relativistic effective potential with an extra 1/r^3 term, and the radial plunge from rest at infinity, whose finite proper time but divergent Schwarzschild coordinate time at r = 2M sets up the later black-hole chapters.",
 "role_in_book": "Third chapter of Part IV. Chapter 20 built Newtonian orbits around an effective potential and Chapter 21 produced the Schwarzschild line element; this chapter is the bridge that turns that metric into trajectories. It supplies the working toolkit (Killing-vector constants of motion, u.u = -1 or 0, the dx/dt = u^i/u^t trick, static-observer vielbeins) that Chapter 23 uses for bound orbits and perihelion precession, Chapter 24 for photon paths, and Chapter 25 for the horizon. Consistent with the book's spiral design, the Killing-vector rule is used as an unproved recipe here and only justified geometrically in Chapter 33, and the puzzle of the infinite coordinate time to reach r = 2M is flagged and deliberately left for Chapter 25.",
 "assumed_background": [
  {
   "topic": "The Schwarzschild line element and the meaning of its coordinates t, r, theta, phi",
   "source": "earlier-in-this-book",
   "where": "GA ch21"
  },
  {
   "topic": "Free fall as geodesic motion and the geodesic equation with connection coefficients",
   "source": "earlier-in-this-book",
   "where": "GA ch08, ch09"
  },
  {
   "topic": "Four-velocity, four-momentum, and energy measured by an observer as minus the dot product of momentum with the observer's velocity",
   "source": "earlier-in-this-book",
   "where": "GA ch02"
  },
  {
   "topic": "Metric components as dot products of coordinate basis vectors, g_{mu nu} = e_mu . e_nu, and index lowering",
   "source": "earlier-in-this-book",
   "where": "GA ch05"
  },
  {
   "topic": "Orthonormal frames, vielbein components and freely falling frames",
   "source": "earlier-in-this-book",
   "where": "GA ch10"
  },
  {
   "topic": "Newtonian orbits reduced to one-dimensional motion in an effective potential",
   "source": "earlier-in-this-book",
   "where": "GA ch20 §20.3"
  },
  {
   "topic": "Gravitational frequency shift from the equivalence principle",
   "source": "earlier-in-this-book",
   "where": "GA ch06"
  },
  {
   "topic": "Geometrized units with G = c = 1 so that M stands for GM/c^2",
   "source": "earlier-in-this-book",
   "where": "GA ch21"
  },
  {
   "topic": "Conservation of energy and angular momentum in central-force problems",
   "source": "undergrad-mechanics",
   "where": null
  },
  {
   "topic": "Separable first-order ODEs, substitution and partial-fraction integrals giving logarithms",
   "source": "undergrad-calculus",
   "where": null
  }
 ],
 "learning_objectives": [
  "Reader can scan a metric for coordinates that appear in none of its components and write down the corresponding Killing vectors in component form.",
  "Reader can form the conserved quantities E-tilde = -xi.u and L-tilde = eta.u for Schwarzschild and interpret them as energy and angular momentum per unit rest mass as judged from far away.",
  "Reader can state the normalization u.u = -1 for massive particles (proper time as parameter) and u.u = 0 for light (affine parameter) and explain why it carries information about the kind of particle.",
  "Reader can derive the gravitational redshift formula omega_inf = omega_R (1 - 2M/R)^{1/2} by writing a static observer's four-velocity as a multiple of the time Killing vector and using conservation of xi.p.",
  "Reader can reduce equatorial geodesic motion to the one-dimensional equation E_eff = (1/2)(dr/dtau)^2 + V_eff(r) and identify the extra -M L^2/r^3 term relative to the Newtonian effective potential.",
  "Reader can sketch the relativistic effective potential, explain the inner maximum and the fall to minus infinity at small r, and restore G and c to show the correction is order 1/c^2.",
  "Reader can solve the radial plunge from rest at infinity: E-tilde = 1, dr/dtau = -(2M/r)^{1/2}, the four-velocity components, and r(tau) proportional to (tau_* - tau)^{2/3}.",
  "Reader can integrate dt/dr for the plunge and show that Schwarzschild coordinate time diverges logarithmically as r -> 2M while proper time stays finite.",
  "Reader can contrast the coordinate speed dr/dt, which goes to zero at r = 2M, with the speed measured by a local static observer, which tends to the speed of light there for any infall energy.",
  "Reader can convert coordinate quantities into what a static observer measures using the vielbein factors (1 - 2M/r)^{+1/2} for time and (1 - 2M/r)^{-1/2} for radial distance.",
  "Reader can apply the same toolkit to exercises such as the gravitational clock effect for airborne clocks and the relative speed of two radially separated observers."
 ],
 "teaching_approach": {
  "summary": "A deliberately economical chapter whose message is that symmetry plus normalization beats brute force. The authors open by admitting that solving the geodesic equation looks daunting, then promise that conserved quantities, exactly as in Newtonian orbit problems, will do the work. A boxed three-step recipe (look for absent coordinates, name the Killing vector, dot it with the velocity) is given without proof and immediately applied to Schwarzschild. Every later result uses only these ingredients, most of them packaged as shaded Example blocks: the redshift (argued in running text rather than an Example) via a static observer whose velocity is proportional to the time Killing vector, the effective potential via u.u = -1, a Newtonian-limit check by restoring G and c, and the radial plunge with its three clocks and two speeds. The recurring pedagogical contrast is coordinate quantities versus what a local observer actually measures, handled with vielbein factors. Surprising results (frozen coordinate time at 2M) are stated, graphed, and explicitly postponed to Chapter 25.",
  "style_tags": [
   "computational-recipe",
   "physical-motivation-first",
   "example-driven",
   "derivation-heavy",
   "conversational-informal",
   "spiral-revisit",
   "diagram-driven"
  ],
  "narrative_arc": [
   "Motivating worry: finding orbits seems to require the full geodesic equation and all the Christoffel symbols of the Schwarzschild metric",
   "Reassurance by analogy: Newtonian orbit problems collapse once energy and angular momentum conservation are used, so look for relativistic counterparts",
   "Recipe (stated, not proved): coordinates absent from the metric give Killing vectors, and their dot product with a geodesic's tangent is constant",
   "Application: t and phi are absent, giving xi = e_t and eta = e_phi and the constants E-tilde and L-tilde, interpreted per unit rest mass and as seen from infinity",
   "Second ingredient: u.u = -1 or 0 encodes whether the free-falling object is massive or light",
   "First payoff (photons): static observer's velocity written as (1 - 2M/r)^{-1/2} xi, so conserved xi.p yields the gravitational redshift in one line",
   "Toolbox recap as a margin checklist beside the start of §22.3: normalization, Killing rule, and dx/dt = (dx/dtau)/u^t",
   "Second payoff (massive particles): substitute E-tilde and L-tilde into u.u = -1 for equatorial motion to get an energy equation with a relativistic effective potential",
   "Check: compare with the Newtonian effective potential of Chapter 20; restore G and c to show the new term is a 1/c^2 correction scaling as 1/r^3",
   "Measurement caveat: coordinate components must be converted with the static-observer vielbein, and moving observers need their own frame",
   "Worked application: radial plunge from rest at infinity; derive u^mu, proper-time law r(tau) and coordinate-time law t(r)",
   "Surprise: infinite coordinate time but finite proper time to reach r = 2M; explicitly deferred to Chapter 25",
   "Second surprise: coordinate speed vanishes at 2M while a local static observer measures the infall speed approaching c",
   "Hand-off to Chapter 23 on orbits; exercises extend to proper acceleration, escape speed, Hafele-Keating clocks and relative velocities"
  ],
  "signature_moves": [
   "Replace the geodesic equation by 'conserved quantities from absent coordinates plus u.u = -1', presented as a boxed, numbered recipe.",
   "Express a static observer's four-velocity as a scalar multiple of the time-translation Killing vector so that measured energies become ratios of normalization factors.",
   "Force the relativistic result into the exact algebraic shape of the Newtonian effective-potential equation of Chapter 20, then point to the single extra term.",
   "Define the Newtonian energy through E-tilde = (mc^2 + E_N)/mc^2 and restore G and c to read the relativistic correction as an order-1/c^2 addition.",
   "Put the same plunging particle on three graphs (r against tau, r against t, speed against r) so the coordinate-versus-proper contrast is visual.",
   "Use margin notes to carry supporting derivations (the observer-at-infinity energy rule, the falling-frame vielbein, the coordinate escape velocity) so the main text stays short.",
   "State an alarming result plainly (the infaller never reaches 2M in coordinate time) and promise its resolution later rather than resolving it immediately."
  ]
 },
 "sections": [
  {
   "number": null,
   "title": "Chapter opening: from metric to motion",
   "printed_page": 237,
   "pdf_page": 254,